domain	utterance	seqlogical
reminder	Add 8:00 AM as time to my next meeting reminder	[IN:UPDATE_REMINDER_DATE_TIME Add [SL:DATE_TIME_NEW 8 : 00 AM ] as time to [SL:PERSON_REMINDED my ] [SL:ORDINAL next ] [SL:TODO meeting ] reminder ]
reminder	Can you remind my girlfriend to take the dog out.	[IN:CREATE_REMINDER Can you remind [SL:PERSON_REMINDED [IN:GET_CONTACT [SL:CONTACT_RELATED my ] [SL:TYPE_RELATION girlfriend ] ] ] to [SL:TODO take the dog out ] . ]
reminder	Remind me to send James an e-mail at 8:00 tomorrow morning	[IN:CREATE_REMINDER Remind [SL:PERSON_REMINDED me ] to [SL:TODO [IN:SEND_MESSAGE send [SL:RECIPIENT James ] an e - mail ] ] [SL:DATE_TIME at 8 : 00 tomorrow morning ] ]
reminder	Edit reminder to update time logs from 9:00 pm to 8:30, daily.	[IN:UPDATE_REMINDER Edit reminder to [SL:TODO update time logs ] [SL:DATE_TIME from 9 : 00 pm ] [SL:RECURRING_DATE_TIME_NEW [IN:GET_RECURRING_DATE_TIME [SL:DATE_TIME to 8 : 30 ] , [SL:FREQUENCY daily ] ] ] . ]
reminder	Remind to send an email to Zach's new teacher.	[IN:CREATE_REMINDER Remind to [SL:TODO [IN:SEND_MESSAGE send an email to [SL:RECIPIENT Zach 's new teacher ] ] ] . ]
reminder	Modify my reminder to set the alarm to only the weekends	[IN:UPDATE_REMINDER Modify [SL:PERSON_REMINDED my ] reminder to [SL:TODO set the alarm to only the weekends ] ]
reminder	Set up a reminder for my Mom to go to the doctor at 3 pm Wednesday.	[IN:CREATE_REMINDER Set up a reminder for [SL:PERSON_REMINDED [IN:GET_CONTACT [SL:CONTACT_RELATED my ] [SL:TYPE_RELATION Mom ] ] ] to [SL:TODO go to the doctor ] [SL:DATE_TIME at 3 pm Wednesday ] . ]
reminder	Add mopping floors to my chores reminder this Friday.	[IN:UPDATE_REMINDER_TODO Add [SL:TODO_NEW mopping floors ] to [SL:PERSON_REMINDED my ] [SL:TODO chores ] reminder [SL:DATE_TIME this Friday ] . ]
reminder	Update the swim schedule reminder.	[IN:UPDATE_REMINDER Update the [SL:TODO swim schedule ] reminder . ]
reminder	What is my next reminder?	[IN:GET_REMINDER What is [SL:PERSON_REMINDED my ] [SL:ORDINAL next ] reminder ? ]
reminder	When was my first reminder?	[IN:GET_REMINDER When was [SL:PERSON_REMINDED my ] [SL:ORDINAL first ] reminder ? ]
reminder	Update all of this week's swimming reminders.	[IN:UPDATE_REMINDER Update [SL:AMOUNT all ] [SL:DATE_TIME of this week ] 's [SL:TODO swimming ] reminders . ]
reminder	How many reminders are scheduled for tomorrow?	[IN:GET_REMINDER_AMOUNT How many reminders are scheduled [SL:DATE_TIME for tomorrow ] ? ]
reminder	Add Christmas shopping reminder to Fall chores.	[IN:UPDATE_REMINDER_TODO Add [SL:TODO_NEW Christmas shopping ] reminder to [SL:TODO Fall chores ] . ]
reminder	please change reminder to buy anniversary cake to ice cream cake	[IN:UPDATE_REMINDER_TODO please change reminder to [SL:TODO buy anniversary cake ] to [SL:TODO_NEW ice cream cake ] ]
reminder	Please change Work Trainings reminder from daily to weekly.	[IN:UPDATE_REMINDER Please change [SL:TODO Work Trainings ] reminder [SL:RECURRING_DATE_TIME [IN:GET_RECURRING_DATE_TIME from [SL:FREQUENCY daily ] ] ] [SL:RECURRING_DATE_TIME_NEW [IN:GET_RECURRING_DATE_TIME to [SL:FREQUENCY weekly ] ] ] . ]
reminder	Remove the reminder to email Stacy.	[IN:DELETE_REMINDER Remove the reminder to [SL:TODO [IN:SEND_MESSAGE email [SL:RECIPIENT Stacy ] ] ] . ]
reminder	Set up a reminder for my brother to contact the realtor tomorrow at 11am.	[IN:CREATE_REMINDER Set up a reminder for [SL:PERSON_REMINDED [IN:GET_CONTACT [SL:CONTACT_RELATED my ] [SL:TYPE_RELATION brother ] ] ] to [SL:TODO contact the realtor ] [SL:DATE_TIME tomorrow at 11 am ] . ]
reminder	Did I set a location for the concerts reminder	[IN:GET_REMINDER_LOCATION Did I set a location for the [SL:TODO concerts ] reminder ]
reminder	Remind me when it my anniversary with my boyfriend	[IN:CREATE_REMINDER Remind [SL:PERSON_REMINDED me ] when it [SL:TODO [IN:GET_TODO [SL:TODO my anniversary ] with [SL:ATTENDEE [IN:GET_CONTACT [SL:CONTACT_RELATED my ] [SL:TYPE_RELATION boyfriend ] ] ] ] ] ]
reminder	cancel my most recent reminder	[IN:DELETE_REMINDER cancel [SL:PERSON_REMINDED my ] [SL:ORDINAL most recent ] reminder ]
reminder	Can you find me the reminder I set up for my next dermatologist appointment?	[IN:GET_REMINDER Can you find me the reminder I set up for [SL:PERSON_REMINDED my ] [SL:ORDINAL next ] [SL:TODO dermatologist appointment ] ? ]
reminder	Also add the vitamin supplements in the grocery shopping reminders.	[IN:UPDATE_REMINDER_TODO Also add the [SL:TODO_NEW vitamin supplements ] in the [SL:TODO grocery shopping ] reminders . ]
reminder	where and what time does the dinner reminder say for tonight	[IN:GET_REMINDER_LOCATION where and what time does the [SL:TODO dinner ] reminder say [SL:DATE_TIME for tonight ] ]
reminder	when is my next reminder for a football game	[IN:GET_REMINDER_DATE_TIME when is [SL:PERSON_REMINDED my ] [SL:ORDINAL next ] reminder for [SL:TODO a football game ] ]
reminder	Add James to my bachelor party reminder.	[IN:UPDATE_REMINDER Add [SL:ATTENDEE_ADDED James ] to [SL:PERSON_REMINDED my ] [SL:TODO bachelor party ] reminder . ]
reminder	Remind me at 2:00 p.m. today to text Amy about the fishing trip this week.	[IN:CREATE_REMINDER Remind [SL:PERSON_REMINDED me ] [SL:DATE_TIME at 2 : 00 p.m . today ] to [SL:TODO [IN:GET_TODO [SL:TODO [IN:SEND_MESSAGE text [SL:RECIPIENT Amy ] about [SL:CONTENT_EXACT the fishing trip ] ] ] [SL:DATE_TIME this week ] ] ] . ]
reminder	Show me my next reminder for today	[IN:GET_REMINDER [SL:METHOD_RETRIEVAL_REMINDER Show ] me [SL:PERSON_REMINDED my ] [SL:ORDINAL next ] reminder [SL:DATE_TIME for today ] ]
reminder	Alert me to write on Mondays at 5pm instead of Tuesdays.	[IN:UPDATE_REMINDER Alert [SL:PERSON_REMINDED me ] to [SL:TODO write ] [SL:RECURRING_DATE_TIME_NEW [IN:GET_RECURRING_DATE_TIME [SL:DATE_TIME on Mondays at 5 pm ] ] ] instead [SL:RECURRING_DATE_TIME [IN:GET_RECURRING_DATE_TIME [SL:DATE_TIME of Tuesdays ] ] ] . ]
reminder	How do I see my reminders for dental examination?	[IN:HELP_REMINDER How do I see my reminders for dental examination ? ]
reminder	Remind me to send Chris an email about the client request for the conference	[IN:CREATE_REMINDER Remind [SL:PERSON_REMINDED me ] to [SL:TODO [IN:SEND_MESSAGE send [SL:RECIPIENT Chris ] an email about [SL:CONTENT_EXACT the client request for the conference ] ] ] ]
reminder	Change my weekly sales forecast reminder to monthly on the first Thursday	[IN:UPDATE_REMINDER Change [SL:PERSON_REMINDED my ] [SL:RECURRING_DATE_TIME [IN:GET_RECURRING_DATE_TIME [SL:FREQUENCY weekly ] ] ] [SL:TODO sales forecast ] reminder [SL:RECURRING_DATE_TIME_NEW [IN:GET_RECURRING_DATE_TIME to [SL:FREQUENCY monthly ] [SL:DATE_TIME on the first Thursday ] ] ] ]
reminder	What reminders am I sharing with my kids?	[IN:GET_REMINDER What reminders am [SL:PERSON_REMINDED I ] sharing with [SL:PERSON_REMINDED [IN:GET_CONTACT [SL:CONTACT_RELATED my ] [SL:TYPE_RELATION kids ] ] ] ? ]
reminder	when is my next reminder for the dog set for	[IN:GET_REMINDER_DATE_TIME when is [SL:PERSON_REMINDED my ] [SL:ORDINAL next ] reminder for [SL:TODO the dog ] set for ]
reminder	Please add Cecilia to my doctor's appointment reminder.	[IN:UPDATE_REMINDER Please add [SL:PERSON_REMINDED_ADDED Cecilia ] to [SL:PERSON_REMINDED my ] [SL:TODO doctor 's appointment ] reminder . ]
reminder	show me my next 5 reminders	[IN:GET_REMINDER [SL:METHOD_RETRIEVAL_REMINDER show ] me [SL:PERSON_REMINDED my ] [SL:ORDINAL next ] [SL:AMOUNT 5 ] reminders ]
reminder	Add pens to my 5 pm reminder tomorrow	[IN:UPDATE_REMINDER_TODO Add [SL:TODO_NEW pens ] to [SL:PERSON_REMINDED my ] [SL:DATE_TIME 5 pm ] reminder [SL:DATE_TIME tomorrow ] ]
reminder	How many reminders do I have set for workouts this weeek	[IN:GET_REMINDER_AMOUNT How many reminders do [SL:PERSON_REMINDED I ] have set for [SL:TODO workouts ] [SL:DATE_TIME this weeek ] ]
reminder	Change my morning wakeup reminder to 8am every day this week.	[IN:UPDATE_REMINDER Change [SL:PERSON_REMINDED my ] [SL:DATE_TIME morning ] [SL:TODO wakeup ] reminder [SL:RECURRING_DATE_TIME_NEW [IN:GET_RECURRING_DATE_TIME [SL:DATE_TIME to 8 am ] [SL:FREQUENCY every day ] [SL:DATE_TIME this week ] ] ] . ]
reminder	add butter to my reminder to buy bread	[IN:UPDATE_REMINDER_TODO add [SL:TODO_NEW butter ] to [SL:PERSON_REMINDED my ] reminder to [SL:TODO buy bread ] ]
reminder	Change my reminder for tomorrow To say that my appointment was canceled	[IN:UPDATE_REMINDER_TODO Change [SL:PERSON_REMINDED my ] reminder [SL:DATE_TIME for tomorrow ] To say that [SL:TODO_NEW my appointment was canceled ] ]
reminder	Please show me reminders when my next test in Biology class	[IN:GET_REMINDER_DATE_TIME Please [SL:METHOD_RETRIEVAL_REMINDER show ] me reminders when [SL:PERSON_REMINDED my ] [SL:ORDINAL next ] [SL:TODO test in Biology class ] ]
reminder	Can you remind me to send Davy a congratulations text tomorrow morning at 9am?	[IN:CREATE_REMINDER Can you remind [SL:PERSON_REMINDED me ] to [SL:TODO [IN:SEND_MESSAGE send [SL:RECIPIENT Davy ] a [SL:CONTENT_EXACT congratulations ] text ] ] [SL:DATE_TIME tomorrow morning at 9 am ] ? ]
reminder	Update reminder for  Kyoto to osaka travel date.   Change according to new schedule.	[IN:UPDATE_REMINDER Update reminder for [SL:TODO Kyoto to osaka travel date ] . Change according to new schedule . ]
reminder	Delete my daughter's recital reminder for tomorrow.	[IN:DELETE_REMINDER Delete [SL:PERSON_REMINDED [IN:GET_CONTACT [SL:CONTACT_RELATED my ] [SL:TYPE_RELATION daughter ] ] ] 's [SL:TODO recital ] reminder [SL:DATE_TIME for tomorrow ] . ]
reminder	are there more than ten reminders set currently	[IN:GET_REMINDER_AMOUNT are there more than ten reminders set currently ]
reminder	Remind me to text husband to bring home dinner on his way home today.	[IN:CREATE_REMINDER Remind [SL:PERSON_REMINDED me ] to [SL:TODO [IN:SEND_MESSAGE text [SL:RECIPIENT [IN:GET_CONTACT [SL:TYPE_RELATION husband ] ] ] to [SL:CONTENT_EXACT bring home dinner on his way home ] ] ] [SL:DATE_TIME today ] . ]
reminder	What's my next reminder	[IN:GET_REMINDER What 's [SL:PERSON_REMINDED my ] [SL:ORDINAL next ] reminder ]
reminder	Add milk and bagels to my grocery reminder this week.	[IN:UPDATE_REMINDER_TODO Add [SL:TODO_NEW milk and bagels ] to [SL:PERSON_REMINDED my ] [SL:TODO grocery ] reminder [SL:DATE_TIME this week ] . ]
reminder	Remind me to send an email to Jessie on Friday at 11am.	[IN:CREATE_REMINDER Remind [SL:PERSON_REMINDED me ] to [SL:TODO [IN:SEND_MESSAGE send an email to [SL:RECIPIENT Jessie ] ] ] [SL:DATE_TIME on Friday at 11 am ] . ]
reminder	Remind me to email Sam about the building blueprint Thursday at 4pm.	[IN:CREATE_REMINDER Remind [SL:PERSON_REMINDED me ] to [SL:TODO [IN:SEND_MESSAGE email [SL:RECIPIENT Sam ] about [SL:CONTENT_EXACT the building blueprint ] ] ] [SL:DATE_TIME Thursday at 4 pm ] . ]
reminder	Add Mark's albuterol to my monthly prescription refill reminder.	[IN:UPDATE_REMINDER_TODO Add [SL:TODO_NEW Mark 's albuterol ] to [SL:PERSON_REMINDED my ] [SL:RECURRING_DATE_TIME [IN:GET_RECURRING_DATE_TIME [SL:FREQUENCY monthly ] ] ] [SL:TODO prescription refill ] reminder . ]
reminder	how do i cancel a reminder	[IN:HELP_REMINDER how do i cancel a reminder ]
reminder	What is the Venue on the reminder, for Shalini's Wedding Reception?	[IN:GET_REMINDER_LOCATION What is the Venue on the reminder , for [SL:TODO Shalini 's Wedding Reception ] ? ]
reminder	Remind me to reply to Lyndy and tell her I can meet at Starbucks at 9:45 a.m.	[IN:CREATE_REMINDER Remind [SL:PERSON_REMINDED me ] to [SL:TODO [IN:REPLY_MESSAGE reply to [SL:RECIPIENT Lyndy ] and tell her [SL:CONTENT_EXACT I can meet at Starbucks ] ] ] [SL:DATE_TIME at 9 : 45 a.m . ] ]
reminder	can you add recycleables to my thursday trash reminder	[IN:UPDATE_REMINDER_TODO can you add [SL:TODO_NEW recycleables ] to [SL:PERSON_REMINDED my ] [SL:DATE_TIME thursday ] [SL:TODO trash ] reminder ]
reminder	Update reminder to shred checks after being cashed.	[IN:UPDATE_REMINDER Update reminder to [SL:TODO shred checks after being cashed ] . ]
reminder	Add to go buy the medicines before, on the reminder with my father.	[IN:UPDATE_REMINDER_TODO Add to [SL:TODO_NEW go buy the medicines before ] , on the reminder with [SL:ATTENDEE [IN:GET_CONTACT [SL:CONTACT_RELATED my ] [SL:TYPE_RELATION father ] ] ] . ]
reminder	Set up a reminder for my brother and cousin that the picnic starts at 4PM on Sunday.	[IN:CREATE_REMINDER Set up a reminder for [SL:PERSON_REMINDED [IN:GET_CONTACT [SL:CONTACT_RELATED my ] [SL:TYPE_RELATION brother ] ] ] and [SL:PERSON_REMINDED [IN:GET_CONTACT [SL:TYPE_RELATION cousin ] ] ] that [SL:TODO the picnic starts ] [SL:DATE_TIME at 4 PM on Sunday ] . ]
reminder	Remind me to shoot an email to my son's teacher for missing school today.	[IN:CREATE_REMINDER Remind [SL:PERSON_REMINDED me ] to [SL:TODO [IN:SEND_MESSAGE shoot an email to [SL:RECIPIENT my son 's teacher ] for [SL:CONTENT_EXACT missing school ] ] ] [SL:DATE_TIME today ] . ]
reminder	What is the last reminder I set on Friday that was for doing something today	[IN:GET_REMINDER What is the [SL:ORDINAL last ] reminder [SL:PERSON_REMINDED I ] set [SL:DATE_TIME on Friday ] that was for [SL:TODO [IN:GET_TODO [SL:TODO doing something ] [SL:DATE_TIME today ] ] ] ]
reminder	what time is my next reminder set for	[IN:GET_REMINDER_DATE_TIME what time is [SL:PERSON_REMINDED my ] [SL:ORDINAL next ] reminder set for ]
reminder	remind me to reply to uncle bens email on sunday	[IN:CREATE_REMINDER remind [SL:PERSON_REMINDED me ] to [SL:TODO [IN:REPLY_MESSAGE reply to [SL:RECIPIENT [IN:GET_CONTACT [SL:TYPE_RELATION uncle ] [SL:CONTACT bens ] ] ] email ] ] [SL:DATE_TIME on sunday ] ]
reminder	Set up a daily reminder for my husband to take his medication	[IN:CREATE_REMINDER Set up a [SL:RECURRING_DATE_TIME [IN:GET_RECURRING_DATE_TIME [SL:FREQUENCY daily ] ] ] reminder for [SL:PERSON_REMINDED [IN:GET_CONTACT [SL:CONTACT_RELATED my ] [SL:TYPE_RELATION husband ] ] ] to [SL:TODO take his medication ] ]
reminder	change reminder to text mom tomorrow to 10 am	[IN:UPDATE_REMINDER_DATE_TIME change reminder to [SL:TODO [IN:GET_TODO [SL:TODO [IN:SEND_MESSAGE text [SL:RECIPIENT [IN:GET_CONTACT [SL:TYPE_RELATION mom ] ] ] ] ] [SL:DATE_TIME tomorrow ] ] ] to [SL:DATE_TIME_NEW 10 am ] ]
reminder	Cancel my reminder to email Dad.	[IN:DELETE_REMINDER Cancel [SL:PERSON_REMINDED my ] reminder to [SL:TODO [IN:SEND_MESSAGE email [SL:RECIPIENT [IN:GET_CONTACT [SL:TYPE_RELATION Dad ] ] ] ] ] . ]
reminder	Change reminders to weekly pick up groceries  to also pick up wine	[IN:UPDATE_REMINDER_TODO Change reminders [SL:RECURRING_DATE_TIME [IN:GET_RECURRING_DATE_TIME to [SL:FREQUENCY weekly ] ] ] [SL:TODO pick up groceries ] to [SL:TODO_NEW also pick up wine ] ]
reminder	Remind me to email all my income statements to the mortgage lender	[IN:CREATE_REMINDER Remind [SL:PERSON_REMINDED me ] to [SL:TODO [IN:SEND_MESSAGE email [SL:CONTENT_EXACT all my income statements ] to [SL:RECIPIENT the mortgage lender ] ] ] ]
reminder	Add milk and cheese to tomorrow's grocery list reminder.	[IN:UPDATE_REMINDER_TODO Add [SL:TODO_NEW milk ] and [SL:TODO_NEW cheese ] [SL:DATE_TIME to tomorrow ] 's [SL:TODO grocery list ] reminder . ]
reminder	modify my weekly appointment reminder to Tuesdays at 5pm instead of 2pm	[IN:UPDATE_REMINDER modify [SL:PERSON_REMINDED my ] [SL:RECURRING_DATE_TIME [IN:GET_RECURRING_DATE_TIME [SL:FREQUENCY weekly ] ] ] [SL:TODO appointment ] reminder [SL:RECURRING_DATE_TIME_NEW [IN:GET_RECURRING_DATE_TIME [SL:DATE_TIME to Tuesdays at 5 pm ] ] ] instead [SL:DATE_TIME of 2 pm ] ]
reminder	what is my last reminder of the day?	[IN:GET_REMINDER what is [SL:PERSON_REMINDED my ] [SL:ORDINAL last ] reminder [SL:DATE_TIME of the day ] ? ]
reminder	Check my reminders for the location of the meeting this afternoon.	[IN:GET_REMINDER_LOCATION Check [SL:PERSON_REMINDED my ] reminders for the location of [SL:TODO the meeting ] [SL:DATE_TIME this afternoon ] . ]
reminder	Remind me of the dinner date with my cousin Adeola	[IN:CREATE_REMINDER Remind [SL:PERSON_REMINDED me ] of [SL:TODO [IN:GET_TODO [SL:TODO the dinner date ] with [SL:ATTENDEE [IN:GET_CONTACT [SL:CONTACT_RELATED my ] [SL:TYPE_RELATION cousin ] [SL:CONTACT Adeola ] ] ] ] ] ]
reminder	Change my pill reminder from 11pm daily to 7am weekly.	[IN:UPDATE_REMINDER Change [SL:PERSON_REMINDED my ] [SL:TODO pill ] reminder [SL:RECURRING_DATE_TIME [IN:GET_RECURRING_DATE_TIME [SL:DATE_TIME from 11 pm ] [SL:FREQUENCY daily ] ] ] [SL:RECURRING_DATE_TIME_NEW [IN:GET_RECURRING_DATE_TIME [SL:DATE_TIME to 7 am ] [SL:FREQUENCY weekly ] ] ] . ]
reminder	Change my Intro to math schedule reminder to Tuesdays at 6pm	[IN:UPDATE_REMINDER Change [SL:PERSON_REMINDED my ] [SL:TODO Intro to math schedule ] reminder [SL:RECURRING_DATE_TIME_NEW [IN:GET_RECURRING_DATE_TIME [SL:DATE_TIME to Tuesdays at 6 pm ] ] ] ]
reminder	Remind me tomorrow morning to email Edward about his car.	[IN:CREATE_REMINDER Remind [SL:PERSON_REMINDED me ] [SL:DATE_TIME tomorrow morning ] to [SL:TODO [IN:GET_TODO [SL:TODO [IN:SEND_MESSAGE email [SL:RECIPIENT Edward ] ] ] [SL:TODO about his car ] ] ] . ]
reminder	Remind me to email the cast about costume fittings tonight.	[IN:CREATE_REMINDER Remind [SL:PERSON_REMINDED me ] to [SL:TODO [IN:SEND_MESSAGE email [SL:RECIPIENT the cast ] about [SL:CONTENT_EXACT costume fittings ] ] ] [SL:DATE_TIME tonight ] . ]
reminder	Update my bedtime reminder to alert me every day of the week.	[IN:UPDATE_REMINDER Update [SL:TODO my bedtime ] reminder to alert [SL:PERSON_REMINDED me ] [SL:RECURRING_DATE_TIME_NEW [IN:GET_RECURRING_DATE_TIME [SL:FREQUENCY every ] [SL:DATE_TIME day of the week ] ] ] . ]
reminder	what are my next 5 reminders for work meetings	[IN:GET_REMINDER what are [SL:PERSON_REMINDED my ] [SL:ORDINAL next ] [SL:AMOUNT 5 ] reminders for [SL:TODO work meetings ] ]
reminder	show me my next reminder	[IN:GET_REMINDER [SL:METHOD_RETRIEVAL_REMINDER show ] me [SL:PERSON_REMINDED my ] [SL:ORDINAL next ] reminder ]
reminder	Help me make a reminder for my classes this semester.	[IN:HELP_REMINDER Help me make a reminder for my classes this semester . ]
reminder	Add a reminder for me to avoid bacon in my IHOP meal with my friends tomorrow at noon.	[IN:CREATE_REMINDER Add a reminder for [SL:PERSON_REMINDED me ] to [SL:TODO [IN:GET_TODO [SL:TODO avoid bacon in my IHOP meal ] with [SL:ATTENDEE [IN:GET_CONTACT [SL:CONTACT_RELATED my ] [SL:TYPE_RELATION friends ] ] ] ] ] [SL:DATE_TIME tomorrow at noon ] . ]
reminder	Remind my brother about his girlfriend's doctor appointment tomorrow.	[IN:CREATE_REMINDER Remind [SL:PERSON_REMINDED [IN:GET_CONTACT [SL:CONTACT_RELATED my ] [SL:TYPE_RELATION brother ] ] ] about [SL:TODO his girlfriend 's doctor appointment ] [SL:DATE_TIME tomorrow ] . ]
reminder	Delete the reminder about emailing the school.	[IN:DELETE_REMINDER Delete the reminder about [SL:TODO [IN:SEND_MESSAGE emailing [SL:RECIPIENT the school ] ] ] . ]
reminder	Please update my reminder to do routine computer maintenance to reflect defragmenting the hard disk.	[IN:UPDATE_REMINDER_TODO Please update [SL:PERSON_REMINDED my ] reminder to [SL:TODO do routine computer maintenance ] to reflect [SL:TODO_NEW defragmenting the hard disk ] . ]
reminder	How do I remind Michelle about our Grand Canyon plans for November?	[IN:HELP_REMINDER How do I remind Michelle about our Grand Canyon plans for November ? ]
reminder	Remind me to text dad at 9 pm	[IN:CREATE_REMINDER Remind [SL:PERSON_REMINDED me ] to [SL:TODO [IN:SEND_MESSAGE text [SL:RECIPIENT [IN:GET_CONTACT [SL:TYPE_RELATION dad ] ] ] ] ] [SL:DATE_TIME at 9 pm ] ]
reminder	how can I find all of my june reminders?	[IN:HELP_REMINDER how can I find all of my june reminders ? ]
reminder	Send my mom a reminder to pick up bread.	[IN:CREATE_REMINDER Send [SL:PERSON_REMINDED [IN:GET_CONTACT [SL:CONTACT_RELATED my ] [SL:TYPE_RELATION mom ] ] ] a reminder to [SL:TODO pick up bread ] . ]
reminder	Change the reminder to check for photo contests to weekly	[IN:UPDATE_REMINDER Change the reminder to [SL:TODO check for photo contests ] [SL:RECURRING_DATE_TIME_NEW [IN:GET_RECURRING_DATE_TIME to [SL:FREQUENCY weekly ] ] ] ]
reminder	Add Bob to my reminder regarding employment.	[IN:UPDATE_REMINDER Add [SL:PERSON_REMINDED_ADDED Bob ] to [SL:PERSON_REMINDED my ] reminder regarding [SL:TODO employment ] . ]
reminder	Update reminders	[IN:UPDATE_REMINDER Update reminders ]
reminder	what time is my next reminder?	[IN:GET_REMINDER_DATE_TIME what time is [SL:PERSON_REMINDED my ] [SL:ORDINAL next ] reminder ? ]
reminder	Add Brian and Matt to all reminders involving steak dinner this month.	[IN:UPDATE_REMINDER Add [SL:PERSON_REMINDED_ADDED Brian ] and [SL:PERSON_REMINDED_ADDED Matt ] to [SL:AMOUNT all ] reminders involving [SL:TODO steak dinner ] [SL:DATE_TIME this month ] . ]
reminder	Set a reminder for my mother to bring Leah to softball practice.	[IN:CREATE_REMINDER Set a reminder for [SL:PERSON_REMINDED [IN:GET_CONTACT [SL:CONTACT_RELATED my ] [SL:TYPE_RELATION mother ] ] ] to [SL:TODO bring Leah to softball practice ] . ]
reminder	Remove the last reminder i set last night.	[IN:DELETE_REMINDER Remove the [SL:ORDINAL last ] reminder [SL:PERSON_REMINDED i ] set [SL:DATE_TIME last night ] . ]
reminder	Do I have any reminders from my boyfriend	[IN:GET_REMINDER Do [SL:PERSON_REMINDED I ] have any reminders from [SL:PERSON_REMINDED [IN:GET_CONTACT [SL:CONTACT_RELATED my ] [SL:TYPE_RELATION boyfriend ] ] ] ]
reminder	How many reminders do I have lined up?	[IN:GET_REMINDER_AMOUNT How many reminders do [SL:PERSON_REMINDED I ] have lined up ? ]
reminder	Remind me and my wife that our daughter's school is closed on the 5th and the 6th of August	[IN:CREATE_REMINDER Remind [SL:PERSON_REMINDED me ] and [SL:PERSON_REMINDED [IN:GET_CONTACT [SL:CONTACT_RELATED my ] [SL:TYPE_RELATION wife ] ] ] that [SL:TODO [IN:GET_TODO [SL:TODO our daughter 's school is closed ] [SL:DATE_TIME on the 5th ] and ] ] [SL:DATE_TIME the 6th of August ] ]
reminder	Remind me to meet with my daughter for lunch on Aug. 18, 2018, at 1:00 PM.	[IN:CREATE_REMINDER Remind [SL:PERSON_REMINDED me ] to [SL:TODO [IN:GET_TODO [SL:TODO meet ] with [SL:ATTENDEE [IN:GET_CONTACT [SL:CONTACT_RELATED my ] [SL:TYPE_RELATION daughter ] ] ] for [SL:TODO lunch ] ] ] [SL:DATE_TIME on Aug . 18 , 2018 , at 1 : 00 PM ] . ]
reminder	Remind me to email Mrs. King tomorrow regarding furniture needing to be moved from my classroom.	[IN:CREATE_REMINDER Remind [SL:PERSON_REMINDED me ] to [SL:TODO [IN:GET_TODO [SL:TODO [IN:SEND_MESSAGE email [SL:RECIPIENT Mrs . King ] ] ] [SL:DATE_TIME tomorrow ] regarding [SL:TODO furniture needing to be moved from my classroom ] ] ] . ]
reminder	Remind me to send an email to all IT group members that the team building excursion will be canceled due to bad weather at 2:00 pm.	[IN:CREATE_REMINDER Remind [SL:PERSON_REMINDED me ] to [SL:TODO [IN:SEND_MESSAGE send an email to all [SL:GROUP IT ] group members that [SL:CONTENT_EXACT the team building excursion will be canceled due to bad weather ] ] ] [SL:DATE_TIME at 2 : 00 pm ] . ]
reminder	How can I see my work reminders for September?	[IN:HELP_REMINDER How can I see my work reminders for September ? ]
reminder	Please update my monthly reminder for bills to biweekly.	[IN:UPDATE_REMINDER Please update [SL:PERSON_REMINDED my ] [SL:RECURRING_DATE_TIME [IN:GET_RECURRING_DATE_TIME [SL:FREQUENCY monthly ] ] ] reminder for [SL:TODO bills ] [SL:RECURRING_DATE_TIME_NEW [IN:GET_RECURRING_DATE_TIME to [SL:FREQUENCY biweekly ] ] ] . ]
reminder	how many reminders do I have set for Friday evening?	[IN:GET_REMINDER_AMOUNT how many reminders do [SL:PERSON_REMINDED I ] have set [SL:DATE_TIME for Friday evening ] ? ]
reminder	remind me to send an email about the kids school information by 5pm today	[IN:CREATE_REMINDER remind [SL:PERSON_REMINDED me ] to [SL:TODO [IN:SEND_MESSAGE send an email about [SL:CONTENT_EXACT the kids school information ] ] ] [SL:DATE_TIME by 5 pm today ] ]
reminder	Tell me how many meeting reminders do I have?	[IN:GET_REMINDER_AMOUNT [SL:METHOD_RETRIEVAL_REMINDER Tell ] me how many [SL:TODO meeting ] reminders do [SL:PERSON_REMINDED I ] have ? ]
reminder	Please change all of Ray's chore reminders to include trimming the bushes	[IN:UPDATE_REMINDER_TODO Please change [SL:AMOUNT all ] of [SL:PERSON_REMINDED Ray ] 's [SL:TODO chore ] reminders to include [SL:TODO_NEW trimming the bushes ] ]
reminder	I need my monthly health check reminder changed to every 6 months.	[IN:UPDATE_REMINDER I need [SL:PERSON_REMINDED my ] [SL:RECURRING_DATE_TIME [IN:GET_RECURRING_DATE_TIME [SL:FREQUENCY monthly ] ] ] [SL:TODO health check ] reminder changed [SL:RECURRING_DATE_TIME [IN:GET_RECURRING_DATE_TIME to [SL:FREQUENCY every 6 months ] ] ] . ]
reminder	Show me all the reminders between me and my mom	[IN:GET_REMINDER [SL:METHOD_RETRIEVAL_REMINDER Show ] [SL:PERSON_REMINDED me ] [SL:AMOUNT all ] the reminders between me and [SL:PERSON_REMINDED [IN:GET_CONTACT [SL:CONTACT_RELATED my ] [SL:TYPE_RELATION mom ] ] ] ]
reminder	Remind me to text Jennifer tomorrow to invite her to the Sips and Sass dinner.	[IN:CREATE_REMINDER Remind [SL:PERSON_REMINDED me ] to [SL:TODO [IN:GET_TODO [SL:TODO [IN:SEND_MESSAGE text [SL:RECIPIENT Jennifer ] ] ] [SL:DATE_TIME tomorrow ] to [SL:TODO invite her to the Sips and Sass dinner ] ] ] . ]
reminder	Can you please tell me about my next work meeting reminder location, time, people going	[IN:GET_REMINDER Can you please [SL:METHOD_RETRIEVAL_REMINDER tell ] me about [SL:PERSON_REMINDED my ] [SL:ORDINAL next ] [SL:TODO work meeting ] reminder location , time , people going ]
reminder	I need to modify one of my son's reminders.	[IN:UPDATE_REMINDER I need to modify one of [SL:PERSON_REMINDED [IN:GET_CONTACT [SL:CONTACT_RELATED my ] [SL:TYPE_RELATION son ] ] ] 's reminders . ]
reminder	Where is the work luncheon reminder and where is the restaurant located.	[IN:GET_REMINDER_LOCATION Where is the [SL:TODO work luncheon ] reminder and where is the restaurant located . ]
